[
  {
    "source_id": "dial.project",
    "name": "DIAL repository engineering policy",
    "trust_tier": "T0_DIAL_PROJECT",
    "source_kind": "PROJECT_LOCAL",
    "domains": [],
    "repositories": [
      "Vanguduza/dial-new"
    ],
    "retrieval_adapters": [
      "LOCAL_REPO"
    ],
    "resource_classes": [
      "RULESET",
      "HOOK",
      "WORKFLOW_LOOP",
      "TOOL"
    ],
    "task_classes": [
      "*"
    ],
    "sensitive_data_allowed": false,
    "executable_content_allowed": true,
    "freshness_ttl_hours": 0,
    "notes": "Project-local development policy. Canon/FRC/security/current repository evidence still outrank VEKL resource hints."
  },
  {
    "source_id": "official.nextjs",
    "name": "Next.js official docs and repository",
    "trust_tier": "T1_OFFICIAL",
    "source_kind": "OFFICIAL_DOCS_REPO",
    "domains": [
      "nextjs.org",
      "github.com"
    ],
    "repositories": [
      "vercel/next.js"
    ],
    "retrieval_adapters": [
      "HTTPS_READ_ONLY",
      "GITHUB_PUBLIC"
    ],
    "resource_classes": [
      "OFFICIAL_DOC",
      "REPOSITORY",
      "RELEASE_NOTES",
      "ISSUE_DISCUSSION"
    ],
    "task_classes": [
      "WEB_UI_IMPLEMENTATION",
      "WEB_SECURITY",
      "WEB_ROUTING"
    ],
    "sensitive_data_allowed": false,
    "executable_content_allowed": false,
    "freshness_ttl_hours": 24
  },
  {
    "source_id": "official.react",
    "name": "React official docs and repository",
    "trust_tier": "T1_OFFICIAL",
    "source_kind": "OFFICIAL_DOCS_REPO",
    "domains": [
      "react.dev",
      "github.com"
    ],
    "repositories": [
      "facebook/react"
    ],
    "retrieval_adapters": [
      "HTTPS_READ_ONLY",
      "GITHUB_PUBLIC"
    ],
    "resource_classes": [
      "OFFICIAL_DOC",
      "REPOSITORY",
      "RELEASE_NOTES",
      "ISSUE_DISCUSSION"
    ],
    "task_classes": [
      "WEB_UI_IMPLEMENTATION",
      "WEB_STATE_MANAGEMENT"
    ],
    "sensitive_data_allowed": false,
    "executable_content_allowed": false,
    "freshness_ttl_hours": 24
  },
  {
    "source_id": "official.typescript",
    "name": "TypeScript official docs and repository",
    "trust_tier": "T1_OFFICIAL",
    "source_kind": "OFFICIAL_DOCS_REPO",
    "domains": [
      "typescriptlang.org",
      "github.com"
    ],
    "repositories": [
      "microsoft/TypeScript"
    ],
    "retrieval_adapters": [
      "HTTPS_READ_ONLY",
      "GITHUB_PUBLIC"
    ],
    "resource_classes": [
      "OFFICIAL_DOC",
      "REPOSITORY",
      "RELEASE_NOTES",
      "ISSUE_DISCUSSION"
    ],
    "task_classes": [
      "TYPESCRIPT_IMPLEMENTATION",
      "BUILD_TOOLING"
    ],
    "sensitive_data_allowed": false,
    "executable_content_allowed": false,
    "freshness_ttl_hours": 48
  },
  {
    "source_id": "official.supabase",
    "name": "Supabase official docs and repository",
    "trust_tier": "T1_OFFICIAL",
    "source_kind": "OFFICIAL_DOCS_REPO",
    "domains": [
      "supabase.com",
      "github.com"
    ],
    "repositories": [
      "supabase/supabase"
    ],
    "retrieval_adapters": [
      "HTTPS_READ_ONLY",
      "GITHUB_PUBLIC"
    ],
    "resource_classes": [
      "OFFICIAL_DOC",
      "REPOSITORY",
      "RELEASE_NOTES",
      "ISSUE_DISCUSSION"
    ],
    "task_classes": [
      "DATABASE",
      "AUTH",
      "RLS_SECURITY",
      "POSTGRES",
      "STORAGE"
    ],
    "sensitive_data_allowed": false,
    "executable_content_allowed": false,
    "freshness_ttl_hours": 24
  },
  {
    "source_id": "official.postgresql",
    "name": "PostgreSQL official documentation",
    "trust_tier": "T1_OFFICIAL",
    "source_kind": "OFFICIAL_DOCS",
    "domains": [
      "postgresql.org"
    ],
    "repositories": [],
    "retrieval_adapters": [
      "HTTPS_READ_ONLY"
    ],
    "resource_classes": [
      "OFFICIAL_DOC",
      "RELEASE_NOTES"
    ],
    "task_classes": [
      "DATABASE",
      "POSTGRES",
      "SQL",
      "RLS_SECURITY"
    ],
    "sensitive_data_allowed": false,
    "executable_content_allowed": false,
    "freshness_ttl_hours": 72
  },
  {
    "source_id": "official.playwright",
    "name": "Playwright official docs and repository",
    "trust_tier": "T1_OFFICIAL",
    "source_kind": "OFFICIAL_DOCS_REPO",
    "domains": [
      "playwright.dev",
      "github.com"
    ],
    "repositories": [
      "microsoft/playwright"
    ],
    "retrieval_adapters": [
      "HTTPS_READ_ONLY",
      "GITHUB_PUBLIC"
    ],
    "resource_classes": [
      "OFFICIAL_DOC",
      "REPOSITORY",
      "RELEASE_NOTES",
      "ISSUE_DISCUSSION",
      "TOOL"
    ],
    "task_classes": [
      "E2E_TESTING",
      "WEB_UI_VERIFICATION",
      "BROWSER_AUTOMATION"
    ],
    "sensitive_data_allowed": false,
    "executable_content_allowed": false,
    "freshness_ttl_hours": 48
  },
  {
    "source_id": "official.vitest",
    "name": "Vitest official docs and repository",
    "trust_tier": "T1_OFFICIAL",
    "source_kind": "OFFICIAL_DOCS_REPO",
    "domains": [
      "vitest.dev",
      "github.com"
    ],
    "repositories": [
      "vitest-dev/vitest"
    ],
    "retrieval_adapters": [
      "HTTPS_READ_ONLY",
      "GITHUB_PUBLIC"
    ],
    "resource_classes": [
      "OFFICIAL_DOC",
      "REPOSITORY",
      "RELEASE_NOTES",
      "ISSUE_DISCUSSION",
      "TOOL"
    ],
    "task_classes": [
      "UNIT_TESTING",
      "TYPESCRIPT_TESTING"
    ],
    "sensitive_data_allowed": false,
    "executable_content_allowed": false,
    "freshness_ttl_hours": 48
  },
  {
    "source_id": "official.zod",
    "name": "Zod official docs and repository",
    "trust_tier": "T1_OFFICIAL",
    "source_kind": "OFFICIAL_DOCS_REPO",
    "domains": [
      "zod.dev",
      "github.com"
    ],
    "repositories": [
      "colinhacks/zod"
    ],
    "retrieval_adapters": [
      "HTTPS_READ_ONLY",
      "GITHUB_PUBLIC"
    ],
    "resource_classes": [
      "OFFICIAL_DOC",
      "REPOSITORY",
      "RELEASE_NOTES",
      "ISSUE_DISCUSSION"
    ],
    "task_classes": [
      "SCHEMA_VALIDATION",
      "TYPESCRIPT_IMPLEMENTATION"
    ],
    "sensitive_data_allowed": false,
    "executable_content_allowed": false,
    "freshness_ttl_hours": 72
  },
  {
    "source_id": "official.maplibre",
    "name": "MapLibre official docs and repository",
    "trust_tier": "T1_OFFICIAL",
    "source_kind": "OFFICIAL_DOCS_REPO",
    "domains": [
      "maplibre.org",
      "github.com"
    ],
    "repositories": [
      "maplibre/maplibre-gl-js",
      "maplibre/maplibre-native"
    ],
    "retrieval_adapters": [
      "HTTPS_READ_ONLY",
      "GITHUB_PUBLIC"
    ],
    "resource_classes": [
      "OFFICIAL_DOC",
      "REPOSITORY",
      "RELEASE_NOTES",
      "ISSUE_DISCUSSION"
    ],
    "task_classes": [
      "DELIVERY_MAPS",
      "MAP_RENDERING",
      "ANDROID_MAPS"
    ],
    "sensitive_data_allowed": false,
    "executable_content_allowed": false,
    "freshness_ttl_hours": 48
  },
  {
    "source_id": "official.osrm",
    "name": "OSRM official repository and documentation",
    "trust_tier": "T1_OFFICIAL",
    "source_kind": "OFFICIAL_DOCS_REPO",
    "domains": [
      "project-osrm.org",
      "github.com"
    ],
    "repositories": [
      "Project-OSRM/osrm-backend"
    ],
    "retrieval_adapters": [
      "HTTPS_READ_ONLY",
      "GITHUB_PUBLIC"
    ],
    "resource_classes": [
      "OFFICIAL_DOC",
      "REPOSITORY",
      "RELEASE_NOTES",
      "ISSUE_DISCUSSION"
    ],
    "task_classes": [
      "DELIVERY_MAPS",
      "ROUTING"
    ],
    "sensitive_data_allowed": false,
    "executable_content_allowed": false,
    "freshness_ttl_hours": 72
  },
  {
    "source_id": "official.vroom",
    "name": "VROOM official repository",
    "trust_tier": "T1_OFFICIAL",
    "source_kind": "OFFICIAL_REPO",
    "domains": [
      "github.com"
    ],
    "repositories": [
      "VROOM-Project/vroom"
    ],
    "retrieval_adapters": [
      "GITHUB_PUBLIC"
    ],
    "resource_classes": [
      "REPOSITORY",
      "RELEASE_NOTES",
      "ISSUE_DISCUSSION"
    ],
    "task_classes": [
      "DELIVERY_MAPS",
      "ROUTE_OPTIMIZATION"
    ],
    "sensitive_data_allowed": false,
    "executable_content_allowed": false,
    "freshness_ttl_hours": 72
  },
  {
    "source_id": "official.nominatim",
    "name": "Nominatim official documentation and repository",
    "trust_tier": "T1_OFFICIAL",
    "source_kind": "OFFICIAL_DOCS_REPO",
    "domains": [
      "nominatim.org",
      "github.com"
    ],
    "repositories": [
      "osm-search/Nominatim"
    ],
    "retrieval_adapters": [
      "HTTPS_READ_ONLY",
      "GITHUB_PUBLIC"
    ],
    "resource_classes": [
      "OFFICIAL_DOC",
      "REPOSITORY",
      "RELEASE_NOTES",
      "ISSUE_DISCUSSION"
    ],
    "task_classes": [
      "DELIVERY_MAPS",
      "GEOCODING"
    ],
    "sensitive_data_allowed": false,
    "executable_content_allowed": false,
    "freshness_ttl_hours": 72
  },
  {
    "source_id": "official.meilisearch",
    "name": "Meilisearch official docs and repositories",
    "trust_tier": "T1_OFFICIAL",
    "source_kind": "OFFICIAL_DOCS_REPO",
    "domains": [
      "meilisearch.com",
      "github.com"
    ],
    "repositories": [
      "meilisearch/meilisearch",
      "meilisearch/documentation"
    ],
    "retrieval_adapters": [
      "HTTPS_READ_ONLY",
      "GITHUB_PUBLIC"
    ],
    "resource_classes": [
      "OFFICIAL_DOC",
      "REPOSITORY",
      "RELEASE_NOTES",
      "ISSUE_DISCUSSION"
    ],
    "task_classes": [
      "SEARCH",
      "CATALOG_SEARCH",
      "DKRF"
    ],
    "sensitive_data_allowed": false,
    "executable_content_allowed": false,
    "freshness_ttl_hours": 48
  },
  {
    "source_id": "official.opentelemetry",
    "name": "OpenTelemetry official docs and repository",
    "trust_tier": "T1_OFFICIAL",
    "source_kind": "OFFICIAL_DOCS_REPO",
    "domains": [
      "opentelemetry.io",
      "github.com"
    ],
    "repositories": [
      "open-telemetry/opentelemetry-specification"
    ],
    "retrieval_adapters": [